{
    "$schema": "https://json-schema.org/draft/2019-09/schema",
    "type": "array",
    "items": {
        "type": "object",
        "properties": {
            "day": {"type":"string"},
            "time": {"type": "string"},
            "activity": {"type": "string"},
            "trainer": {"type": "string"}
        },
        "required": ["day", "time", "activity", "trainer"],
        "additionalProperties": true
    }
}